Authors,Article Name,Publication,Year,Definition Page(s),Definition,,
"Youtie, Jan; Porter, Alan L.; Huang, Ying",Early social science research about Big Data,SCIENCE AND PUBLIC POLICY,2017,65-66,"Big Data is defined on the basis of size, growth, diversity, and analytic capacities.

...

Although the legacy of information technology developments is long, the term ‘Big Data’ has a more recent history that some trace to a special issue of Nature published in September 2008, on the topic, while others allude to earlier or later references. Indeed the term itself has become a ‘meme’ for developments in the 21st century that facilitate the procurement, storage, processing, and analysis of large-scale information compilations. Boyd and Crawford (2012) call out the ‘mythology’ of the term, associating it with an overly optimistic and opportunistic rhetoric. The White House (2014) has drawn on the Gartner Inc. definition of Big Data in terms of the three ‘Vs’ (although more V’s have been added in other definitions):

volume of data collected and processed at a decreasing cost

variety of data, including digital data and data originating in analog forms that can be digitized (see President’s Council of Advisors on Science and Technology 2014)

velocity of data that can be obtained nearly in real-time

The ability to process more information, more quickly, and with greater ease of analysis opens up opportunities in areas such as: medical, business, scientific research, environmental, defense, and climate change applications (Bryant et al. 2008).
Yet it is not solely a matter of scale and opportunity that defines Big Data. It also matters how these methods are used, the extent to which they are divorced from context, applications that could violate privacy and security expectations, and inequities and unethical consequences that these capabilities could create. In sum, important societal considerations accompany Big Data development and applications. Such considerations are not solely the purview of Big Data. Observers underscore the importance of societal considerations in emerging technologies ranging from human genomics to nanotechnology to geoengineering.",,
"Zeng, Jinghan",China's date with big data: will it strengthen or threaten authoritarian rule?,INTERNATIONAL AFFAIRS,2016,1444-1445,"While big data may also include traditional (non-digital) sources of data, this article will primarily focus on digital ones. Thus, big data broadly refers here to an ‘explosion in the quantity and diversity of high frequency digital data’.",,
"Zwitter, Andrej",Big Data and International Relations,ETHICS & INTERNATIONAL AFFAIRS,2015,378-380,"What Is Big Data?
Big Data refers to the enormous amounts of data that, using sophisticated analytics techniques, can be mined for information in order to reveal patterns and spot trends and correlations. A key idea behind the concept is that the sheer volume of data allows users to discover information—specifically, correlations and patterns—that would not be available by looking at smaller samples. It also relates to the enhanced ability to extract information from, and interpret, massive amounts of unstructured data. Another key idea is that Big Data is updated in near real-time. The most important features relevant to understanding Big Data are known as “the three Vs,” which are: 3

Volume: Data today exists in massive amounts, which can be measured in petabytes [1015 bytes], exabytes [1018 bytes], and zetabytes [1021 bytes]. Soon, it will even be measured in yottabytes [1024], one of which equals 250 trillion digital video disks. According to Rick Smolan and Jennifer Erwitt, from the beginning of history until 2011, five billion gigabytes were produced; in 2015 this amount is produced every ten seconds. 4

Velocity: The speed of data creation and its collection now approaches real-time. This concerns not only questions of bandwidth (megabyte and gigabyte upload and download capabilities) but also of implementing information-technology architecture solutions that can cope with data in near real-time.

Variety: Data exists in structured and unstructured forms and in different formats and units of analysis, including documents, emails, social media messages, YouTube videos, pictures, audio, radio-frequency identification chips, 5 satellite imagery, sky cartography, DNA sequencing, phone-network call data, and cell phone GPS signals. Furthermore, it can be categorized depending on its source: for example, there is self-generated data, data collected (mostly in automatized ways) from the web (known as data scraping), and data retrieved from other outside sources.

Some authors add a number of other features that are potentially, but not necessarily, present in Big Data:

Veracity: This fourth V encompasses all sorts of methodological questions about the reliability and validity of data and its sources. For example, possible biases can be generated by the form of collection (do sentiment analyses generated from a certain region based on Twitter feeds actually express the sentiments of that region, or only those of Twitter users from that region?), and the form of data preparation (for example, by removing duplicates, completing partial entries, aggregating results, and so on).

Value: Oracle, for example, considers Big Data to be of low value density; that is, the data received and collected requires much processing before value can be extracted from it. 6

Correlations: Algorithms that analyze Big Data emphasize correlations over causation for the use of predictions and for social engineering, that is, the manipulation of individuals and groups based on social mechanisms. 7

Exhaustiveness: Related to Volume, Big Data becomes potentially all-encompassing of a research population, unlike with statistics, which commonly works with samples that only represent and approximate the whole—that is, the sample size is moving toward a state of N = all. 8

Detailed/Organic Data: Unlike Exhaustiveness, which is about sample size, organic data refers to the degree of granularity of the data within the sample; increasingly, organic data allows for a more accurate digital representation of physical reality in such fine detail that it approaches an organic representation of reality—metaphorically, a 1:1 map of the world. 9

Flexibility: Big Data encompasses extensionality (new dimensions can be added by adding new datasets) and scalability (the size of datasets can be expanded rapidly). 10

Virality: This factor measures how quickly data is spread and shared across networks of people (P2P) to each unique node. The time and rate of the spread of information are the determinant factors. 11 Viral diffusion differs from broadcasting in that the former, acting through a network structure, allows its individual nodes to contribute to social cascades, resulting in viral stories and posts. 12

In sum, Big Data promises an information advantage, be it in business intelligence, state intelligence, or any other form of data gathering and analysis. At least in theory, it offers the ability to become omniscient, if not omnipotent—a promise that is tempting to any business, government, or criminal network.",,
