Authors,Article Name,Publication,Year,Definition Page(s),Definition,,
"Adolf, Marian T.; Stehr, Nico","Information, Knowledge, and the Return of Social Physics",ADMINISTRATION & SOCIETY,2018,1245,"What seems to have resuscitated the old idea of unmasking social reality in its totality by computing the sum of all its parts is the unprecedented availability of digital data on ever wider areas of social and natural life. Real-time monitoring through ubiquitous sensors and the outfitting of everyday appliances with information technology turns social spaces into places of ubiquitous surveillance. As more and more everyday activities are moved into the Internet, as web-based services are used to assist with our daily chores and professional activities, an ever bigger data trail is accumulated. Every telephone call, every online-order, every Google map-query is being logged. The use of Social Network Sites (SNS), of rebate and credit cards, to name just a few, produce activity-based “guest-ids” that hold a great deal of information. Just like meta-data of telephone calls and server log-ins might ultimately reveal more crucial information about an individual than the actual communications they result from, logging our interactions within contemporary media (or information) ecology tells a great deal about what people do. 

This phenomenon, presently discussed under the heading of Big Data, also in the public administration and governance literature (see, for example, Mergel, Rethemeyer, & Isett, 2016), is a token for the increasing informationalization of contemporary social life.",,
"Agostino, Deborah; Arnaboldi, Michela",Social media data used in the measurement of public services effectiveness: Empirical evidence from Twitter in higher education institutions,PUBLIC POLICY AND ADMINISTRATION,2017,297,"The key features of big data are high volumes of data, the high speed with which data are generated and the great variety of data formats, including, alongside traditional excel spreadsheets, data from sensors, mobile phones and social media (Gandomi and Haider, 2015; McAfee and Brynjolfsson, 2012).",,
"Blume, Grant; Scott, Tyler; Pirog, Maureen",Empirical Innovations in Policy Analysis,POLICY STUDIES JOURNAL,2014,S43,"The term “Big Data” represents multidimensional information, often on a massive scale, that is difficult to process or analyze using conventional empirical and statistical tools (Eaton, Deutsch, Deroos, Lapis, & Zikopoloulos, 2012).",,
"Campbell-Verduyn, Malcolm; Goguen, Marcel; Porter, Tony",Big Data and algorithmic governance: the case of financial practices,NEW POLITICAL ECONOMY,2017,220,"Varying definitions of Big Data mostly overlap in a stress on the ‘3Vs’ of volume, variety and velocity. Consisting of ‘ high-volume, high-velocity and high-variety information assets’ (Gartner 2013) beyond the processing capacity of human intelligence (Raley 2013: 132), Big Data yield correlations and patterns through statistical calculations of computer-coded algorithms (Kitchin 2014: 140). Algorithms are automated routines that mobilise information in patterned manners to achieve particular ends (Gillespie 2014). Both Big Data and algorithms involve expansions of information technologies that, while not entirely new, are widely seen as transformational, particularly in the degrees to which they enhance the monitoring of vast domains of human activity.",,
"Chandler, David",A World without Causation: Big Data and the Coming of Age of Posthumanism,MILLENNIUM-JOURNAL OF INTERNATIONAL STUDIES,2015,835-836,"While there is no fixed definition of Big Data, analysts often mention the 3 ‘Vs’ which characterise it: volume, velocity and variety. Big Data includes information from a multitude of sources, including social media, smart phones and mapping, visualising and recording equipment7 and the number of data-sharing devices is growing exponentially. This hardware, collectively known as the ‘Internet of Things’, includes machine sensors and consumer-oriented devices such as connected thermostats, light bulbs, refrigerators, and wearable health monitors.8 Data is thus being produced and used in increasingly diverse and innovative ways. The term ‘Big Data’ is capitalised to distinguish it (as a set of ideas and practices discursively cohered around a certain approach to knowledge production) from its use as a merely descriptive term for a large amount of data. Big Data thus is not used with reference to discussions about the volume of data per se; however, many authors argue that volume is relevant in terms of an analytical ‘tipping point’ or ‘data threshold’ where data gathering is no longer based upon selection and sampling with limited parameters but aspires to be exhaustive or becomes a closed data set, no longer requiring generative rules.9

Thus Big Data discursively refers to a qualitative shift in the meaning of data, in not just the amount of data (approaching exhaustiveness) but also its quality (approaching a dynamic, fine-grained relational richness). This data is very far from the abstract and reductionist constructions of data of the past:10 but is increasingly understood as approaching ‘reality’ itself. Thus, Big Data transforms our everyday reality and our immediate relation to the things around us. This ‘datafication’ of everyday life is at the heart of Big Data: a way of accessing reality through bringing interactions and relationships to the surface and making them visible, readable and thereby governable, rather than seeking to understand hidden laws of causality.11 Big Data is thereby generally understood to generate a different type of ‘knowledge’: more akin to the translation or interpretation of signs rather than that of understanding chains of causation.12",,
"Clark, William Roberts; Golder, Matt","Big Data, Causal Inference, and Formal Theory: Contradictory Trends in Political Science?",PS-POLITICAL SCIENCE & POLITICS,2015,66,"For us, “big data” refers to the idea that tech innovations such as machine learning have allowed scholars to gather either new types of data, such as social media data, or vast quantities of traditional data with less expense.",,
"Clarke, Amanda; Craft, Jonathan",The vestiges and vanguards of policy design in a digital context,CANADIAN PUBLIC ADMINISTRATION-ADMINISTRATION PUBLIQUE DU CANADA,2017,478,"big data—large-scale, unmediated and unstructured data",,
"Cukier, Kenneth; Mayer-Schoenberger, Viktor",The Rise of Big Data How It's Changing the Way We Think About the World,FOREIGN AFFAIRS,2013,29,"Given this massive scale, it is tempting to understand big data solely in terms of size. But that would be misleading. Big data is also characterized by the ability to render into data many aspects of the world that have never been quantified before; call it ""datafication."" For example, location has been datafied, first with the invention of longitude and latitude, and more recently with gps satellite systems. Words are treated as data when computers mine centuries' worth of books. Even friendships and ""likes"" are datafied, via Facebook.

This kind of data is being put to incredible new uses with the assistance of inexpensive computer memory, powerful processors, smart algorithms, clever software, and math that borrows from basic statistics. Instead of trying to ""teach"" a computer how to do things, such as drive a car or translate between languages, which artificial-intelligence experts have tried unsuccessfully to do for decades, the new approach is to feed enough data into a computer so that it can infer the probability that, say, a traffic light is green and not red or that, in a certain context, lumière is a more appropriate substitute for ""light"" than léger.

Using great volumes of information in this way requires three profound changes in how we approach data. The first is to collect and use a lot of data rather than settle for small amounts or samples, as statisticians have done for well over a century. The second is to shed our preference for highly curated and pristine data and instead accept messiness: in an increasing number of situations, a bit of inaccuracy can be tolerated, because the benefits of using vastly more data of variable quality outweigh the costs of using smaller amounts of very exact data. Third, in many instances, we will need to give up our quest to discover the cause of things, in return for accepting correlations. With big data, instead of trying to understand precisely why an engine breaks down or why a drug's side effect disappears, researchers can instead collect and analyze massive quantities of information about such events and everything that is associated with them, looking for patterns that might help predict future occurrences. Big data helps answer what, not why, and often that's good enough.",,
"Desouza, Kevin C.; Jacob, Benoy",Big Data in the Public Sector: Lessons for Practitioners and Scholars,ADMINISTRATION & SOCIETY,2017,1045-1047,"As a relatively new phenomenon, much of the literature on Big Data focuses on defining the “bounds” of Big Data. That is, what is Big Data and what does it mean to operate in a Big Data environment. Despite the ubiquity of the term, Big Data is a difficult term to define (Franks, 2012; Laney, 2001; Manyika et al., 2011). There is, however, some consensus among scholars and practitioners that four factors characterize Big Data—volume, velocity, variety, and complexity.5 More than just simple semantics, these characteristics have potentially important implications for management practices.

Big Data is just too big for us. Where . . . big data begin[s] and end[s] is not known. I have been struggling to identify digestible bites for us to take to move on big data . . . .

First, at its core, Big Data must clearly be “big.” Big Data datasets are “beyond the ability of typical database software tools to capture, store, manage and analyze” (Franks, 2012, p. 4).6 Thus, Big Data, in terms of volume, is a function of the underlying and pre-existing capacity of an organization to collect, store, and analyze its data. This definition suggests that Big Data is, in terms of volume, a moving target. For example, household demographics that were once difficult to manage now “fit on a thumb drive and can be analyzed by a low-end laptop” (Franks, 2012, p. 24).

The second defining characteristic of Big Data is its velocity. This refers to the speed at which data are being created and stored, and their associated rates of retrieval (Kaisler, Armour, Espinosa, & Money, 2013). Much like the volume of data, however, there is no established benchmark by which to consider when data velocity meets a Big Data threshold. Rather, the salient issue is that the data are being created at historically fast rates. An example of the current velocity of data is provided by Mayer-Schonberger and Cukier (2013):

Google processes more than 24 petabytes of data per day, a volume that is thousands of times the quantity of all printed material in the U.S. Library of Congress. Facebook, a company that didn’t exist a decade ago, gets more than 10 million new photos uploaded every hour. Facebook members click a “like” button or leave a comment nearly three billion times a day, creating a digital trail that the company can mine to learn about users’ preferences. Meanwhile, the 800 million monthly users of Google’s YouTube service upload over an hour of video every second. The number of messages on Twitter grows at around 200 percent a year and by 2012 exceeded 400 million tweets a day. (p. 8)

A third defining characteristic of Big Data is its variety. Big Data is comprised of data in a wide range of forms, including text, images, and videos. Generally speaking, then, it will include data that are structured, semi-structured, or unstructured. Structured data refer to data that have an organized structure and are, thus, clearly identifiable. A simple example would be a database with specific information that is stored in columns and rows. Semi-structured data do not conform to a formal structure per se; however, it contains “tags” that help separate the data records or fields. For example, data in many bibliographical software programs reflect semi-structured data. That is, the file is composed of records, but the structure is not regular in the sense that fields may be missing or be comprised of more “open” formats, such as a “Notes” section. Finally, unstructured data, as its name implies, have no identifiable structure. Examples of unstructured data, then, include the following: text messages, photos, videos, and audio files.

As datasets become increasingly “complex”—from structured to unstructured—the processing and analytical capabilities required to collect, manage, and analyze the data increases significantly. Thus, a better understanding of the defining characteristics of an organizations real, or potential, data repositories offers insights into the level and types of investments needed.

The final defining characteristic of Big Data is its complexity—the degree to which the data are interconnected. Many of the novel applications and/or insights that have emerged from Big Data applications are a result of connecting otherwise unrelated datasets. One oft-cited example is the joint effort between Google and the Center for Disease Control (CDC). In this case, Google was able to connect their database of “search terms”—entered in their search engine—such as “cold medicine” and “flu symptoms,” with the CDC’s data on the H1N1 virus. In doing so, analysts were able to predict the spread of the H1N1 virus by “connecting” two previously disconnected datasets.",,
"Durrant, Hannah; Barnett, Julie; Rempel, Emily Suzanne",Realising the Benefits of Integrated Data for Local Policymaking: Rhetoric versus Reality,POLITICS AND GOVERNANCE,2018,19,"Conventional attempts to define big data have tended to focus primarily on its characteristics; initially emphasising its volume, variety, and velocity (see Kitchin & McArdle, 2016). A more recent proliferation of characteristics identified with big data (e.g., Uprichard, 2013) has rendered the term more, rather than less, opaque (Kitchin & McArdle, 2016). In an attempt to isolate the most salient qualities of big data, Kitchin (2014b) stresses the distinction between small data sources—based on a population sample, infrequently collected and processed slowly and periodically—and big data that is both exhaustive (n = all) and generated and reported in close to real time. For Kitchin and McArdle (2016) the two most important characteristics of big data sources are exhaustivity and velocity.",,
"Eldridge, Christopher; Hobbs, Christopher; Moran, Matthew",Fusing algorithms and analysts: open-source intelligence in the age of 'Big Data',INTELLIGENCE AND NATIONAL SECURITY,2018,393-394,"In recent years, the term ‘Big Data’ has become a buzzword of sorts in discussions relating to developments online. Despite its ubiquity in academic and popular discourse, however, the term is poorly understood and often ill-defined. It has become a popular way to refer to the dramatic increase in recent years of the amount of data available online. But the concept represents more than vast quantities of information. McAfee and Brynjolfsson argue that the concept comprises three core factors: volume, variety and velocity. The issue of volume is perhaps the one most frequently highlighted in popular commentary due to the staggering figures involved. According to a prediction published in 2014 by an IT analysis company, the ‘digital universe’ doubles in size every two years and will reach 44 zettabytes by 2020.17 Indeed, for Kevjn Lim, it is the process of digitalisation that is the main driver behind the Big Data phenomenon. In 2000, 25 per cent of the world’s stored information was digital; by 2013, it was over 98 per cent. Equally important for understanding the nature of ‘Big Data’, however, is the variety of the data sources: ‘Big data takes the form of messages, updates and images posted to social networks; readings from sensors; GPS signals from cell phones, and more’. Furthermore, ‘many of the most important sources of Big Data are relatively new’. It is only since the mid-2000s that social networks such as Facebook and Twitter began to gain real momentum. Finally, the speed of data creation is regarded by many as even more important than the volume. On this issue of velocity, McAfee and Brynjolfsson note, ‘Real-time or nearly real-time information makes it possible for a company to be much more agile than its competitors’. This argument is stems from the business context but the logic applies across a range of fields; access to real-time information flows opens up unprecedented analytical opportunities.",,
"Gamage, Pandula",New development: Leveraging big data' analytics in the public sector,PUBLIC MONEY & MANAGEMENT,2016,385,"‘Big data’ is a general term referring to the massive amounts of data collected from many sources, including the web and the cloud (Manzoor, 2015). According to leading information technology and research company, Gartner (2015), big data is: 

…high-volume, high-velocity and/or high-variety information assets that demand cost-effective, innovative forms of information processing that enable enhanced insight, decision-making, and process automation. 

Gartner’s definition includes three characteristics known as the ‘three Vs’: the volume of information that systems must ingest process and disseminate; the velocity at which information grows or disappears; and the variety in the diversity of data sources and formats.",,
"Giest, Sarah",Big data for policymaking: fad or fasttrack?,POLICY SCIENCES,2017,367-368,"Big data is a broad term for the volume and complexity of data that is available. While there is no widely accepted definition of the term, the most basic description is that big data means datasets that are too large for traditional processing systems and require new technologies (Provost and Fawcett 2013). This not only refers to the size of the data, but also to its variety, velocity and veracity. This means that data is collected faster and that there is more variation of data that can be tapped into. Veracity refers to the uncertainty of data. This has to do both with the quality of the data, but also with the uncertainty of those dealing with the data of how accurate and complete this resource is.",,
"Gorham, Ashley E.",Big Data and Democracy: Facts and Values,PS-POLITICAL SCIENCE & POLITICS,2017,"961, n. 1","The most common definition of big data is “high volume, high velocity, and/or high variety information assets” (Gartner 2017). However, as Kitchin and McArdle (2016, 9) noted, “Big Data do no all share the same characteristics and...there are multiple forms of Big Data.” Eschewing technical terms, Clark and Golder (2015, 66) seem to express the general understanding of the term within political science with their conceptualization of big data as “the idea that technological innovations such as machine learning have allowed scholars to gather either new types of data, such as social media data, or vast quantities of traditional data with less expense.”",,
"Hansen, Hans Krause; Porter, Tony",What Do Big Data Do in Global Governance?,GLOBAL GOVERNANCE,2017,31,"Big data build on the exponential growth of data from new sources such as Internet clicks or machine sensors. They stand in contrast to conventional databases bounded and then managed according to specified standards and for predetermined purposes. Big data can involve ongoing streams of data that are processed, analyzed, and immediately supplied to users, in contrast to periodic surveys that may take months or years to process. Three distinctive features of Big data as compared to more conventional data have been identified: volume, variety, and velocity (3Vs).",,
"Hindman, Matthew","Building Better Models: Prediction, Replication, and Machine Learning in the Social Sciences",ANNALS OF THE AMERICAN ACADEMY OF POLITICAL AND SOCIAL SCIENCE,2015,48,"Many argue that the social sciences are on the brink of a “big data revolution.” A growing body of research now uses datasets that are “big” not just in terms of their size, but also in terms of their complexity, their variety, and the speed at which they accumulate.",,
"Hofferth, Sandra L.; Moran, Emilio F.; Entwisle, Barbara; Aber, J. Lawrence; Brady, Henry E.; Conley, Dalton; Cutter, Susan L.; Eckel, Catherine C.; Hamilton, Darrick; Hubacek, Klaus",Introduction: History and Motivation,ANNALS OF THE AMERICAN ACADEMY OF POLITICAL AND SOCIAL SCIENCE,2017,"6 (ABSTRACT), 8","Big data, that is, data that are byproducts of our lives rather than designed for research purposes...

...

big data—large, diverse, and heterogeneous datasets, often by-products generated from business and Internet transactions, email, social media, health care facilities, and various sensors and instruments",,
"Japec, Lilli; Kreuter, Frauke; Berg, Marcus; Biemer, Paul; Decker, Paul; Lampe, Cliff; Lane, Julia; O'Neil, Cathy; Usher, Abe",Big Data in Survey Research,PUBLIC OPINION QUARTERLY,2015,"840, 841-843","The term “Big Data” is an imprecise description of a rich and complicated set of characteristics, practices, techniques, ethical issues, and outcomes all associated with data.

...

In order to know when and how Big Data can be an appropriate technique for social insight, it is important to know more about the different features of Big Data. While there is no singularly preeminent Big Data definition, one very widely used definition comes from a 2001 Gartner report ( Laney 2001 , 2012 ) describing several characteristics of Big Data:

Volume refers to the sheer amount of data available for analysis. This volume of data is driven by the increasing number of data-collection instruments (e.g., social media tools, mobile applications, sensors) as well as the increased ability to store and transfer those data with recent improvements in data storage and networking.

Velocity refers to both the speed at which these data-collection events can occur, and the pressure of managing large streams of real-time data. Across the means of collecting social information, new information is being added to the database at rates ranging from as slow as every hour or so to as fast as thousands of events per second.

Variety refers to the complexity of formats in which Big Data can exist. Besides structured databases, there are large streams of unstructured documents, images, e-mail messages, video, links between devices, and other forms that create a heterogeneous set of data points. One effect of this complexity is that structuring and tying data together becomes a major effort, and therefore a central concern of Big Data analysis.

Others have added additional characteristics to the definition. These include Variability (inconsistency of the data across time), Veracity (ability to trust that the data are accurate), and Complexity (need to link multiple data sources).

There are many different types of Big Data sources; for example, social media data , personal data (e.g., data from tracking devices), sensor data , transactional data , and administrative data .

There are different opinions on whether administrative data should be considered to be Big Data or not. Administrative data are usually large in volume; they are generated for a different purpose and arise organically through administrative processes. Also, the content of administrative data is usually not designed by researchers. For these reasons, and because there is great potential in using administrative data, we will consider it to be in scope for this report.

There are a number of differences between administrative data and other types of Big Data that are worth pointing out. The amount of control a researcher has and the potential inferential power vary between different types of Big Data sources. For example, a researcher will likely not have any control of data from different social media platforms, and it could be difficult to decipher a text from social media. For administrative data, on the other hand, a statistical agency can form a partnership with owners of the data and influence the design of the data. Administrative data are more structured and well defined, and more is known about the data than perhaps other Big Data sources

A dimension of Big Data not often mentioned in the practitioner literature, but important for survey researchers to consider, is that Big Data are often secondary data, intended for another primary use. This means that Big Data are typically related to some non-research purpose and then reused by researchers to make a social observation. This is related to Sean Taylor’s distinction between “found vs. made” data ( Taylor 2013 ). He argues that a key difference between Big Data approaches and other social science approaches is that the data are not being initially “made” through the intervention of some researcher. When a survey researcher constructs an instrument, there are levels of planning and control that are necessarily absent in the data used in Big Data approaches. Big Data sources might have only a few variables, as compared with surveys that have a set of variables of interest to the researcher. In a 2011 Public Opinion Quarterly article and a blog post in his former role as director of the US Census Bureau, Robert Groves described a similar difference between organic and designed data ( Groves 2011a , 2011b ).",,
