Authors,Article Name,Publication,Year,Definition Page(s),Definition,,
"Rogge, Nicky; Agasisti, Tommaso; De Witte, Kristof",Big data and the measurement of public organizations' performance and efficiency: The state-of-the-art,PUBLIC POLICY AND ADMINISTRATION,2017,266-267,"In general, big data refers to huge volumes of (digital) data that are collected from large variety of sources that are too large, raw, or unstructured for analysis through conventional database techniques (Kim et al., 2014: 78). A common framework that is used to describe big data is the ‘3-V’ framework with the three dimensions ‘Volume’, ‘Variety’, and ‘Velocity’ (Brynjolfsson and McAfee, 2012; Chen et al., 2012; Gandomi and Haider, 2015; Kwon et al., 2014). In this framework, ‘Volume’ corresponds to the size of big data (typically multiple terabytes or petabytes). ‘Variety’, refers to the composition of the data set and, more in particular, to the structural heterogeneity in data (i.e. are the data structured, semi-structured, or unstructured). Practice shows that only a minority of the big data are structured. The ‘Velocity’ dimension refers to the dynamic nature of big data – the speed of collecting, storing and analyzing big data. Regarding this dimension, there is an increasing trend toward generating, collecting, storing, and analyzing data at high frequency (in some sectors and applications even real-time or near to real-time). While the volume or size dimension is most discussed in the context of big data, Gandomi and Haider (2015) stress that the other dimensions are equally important. In fact, they emphasize that one should avoid focusing exclusively on one particular dimension as there may be interactions between the dimensions. For instance, the interpretation of the ‘Volume’ dimension (i.e. when can a dataset be considered big data) may very well depend on whether the data are structured or not. Unstructured data usually require more storage and analysis capacities and better technologies than structured data. Therefore the threshold size for unstructured data will be smaller than for structured data. 

Next to the three dimensions of the basic 3-V framework, also other dimensions are sometimes used to characterize big data. Gandomi and Haider (2015) and Gani et al. (2015) describe four of these dimensions: ‘Veracity’ (unreliability and impreciseness of some data sources), ‘Variability’ (similar or dissimilar data flow rates), ‘Complexity’ (few or numerous data sources), and ‘Value’ (relative value density).",,
"Rumson, Alexander G.; Hallett, Stephen H.; Brewer, Timothy R.",Coastal risk adaptation: the potential role of accessible geospatial Big Data,MARINE POLICY,2017,"ABSTRACT, 102","‘Big Data’ involves powerful computer infrastructures, enabling storage, processing and real-time analysis of large volumes and varieties of data, in a fast and reliable manner. 

...

The terminology of Big Data, relates not only to the handling of large volumes of data, but refers also to broader data issues such as the ability to manage concurrently a wide variety of data formats, with the incorporation of high currency and even real-time (high velocity) data [43], [44]; allied to which are a new generation of analytical and data processing capabilities. Central to the concepts surrounding Big Data are the multi-node computer infrastructures employed, enabling the collective storage of large volumes of data in a distributed and scalable manner [45]. Big Data approaches can enable the large, diverse databanks associated with comprehensive environmental risk mapping exercises, to be incorporated successfully within a single modelling framework.",,
"Schintler, Laurie A.; Kulkarni, Rajendra","Big Data for Policy Analysis: The Good, The Bad, and The Ugly",REVIEW OF POLICY RESEARCH,2014,343,"Big data is ripe for policy analysis. While large, high-dimensional data sets have long been fundamental to research in the physical and life sciences, in fields like meteorology, biology, physics, chemistry, and astronomy, the use of big data beyond these disciplinary bounds has been much more limited. However, Web 2.0 services and technologies,1 as well as other recent cyber and technological developments, are producing an enormous and unprecedented amount of data that are rich in detail concerning human and societal behavior and related contextual factors and dynamics, including the attitudes, preferences, and sentiment of different individuals and groups (see, e.g., Bollen, Pepe, & Mao, 2009; Gondecha & Lieu, 2012). These data are not only voluminous, but also highly complex encompassing a variety of content formats (e.g., structured versus unstructured) and levels of spatial and temporal resolution. As a resource for helping to inform different points in the policy analysis process, from problem conceptualization to ongoing evaluation of existing policies, and even empowering and engaging citizens and stakeholders in the process, big data holds tremendous promise.",,
"Severo, Marta; Feredj, Amel; Romele, Alberto",Soft Data and Public Policy: Can Social Media Offer Alternatives to Official Statistics in Urban Policymaking?,POLICY AND INTERNET,2016,357,"Big Data is the most popular one, generally referring to data sets that are huge in volume, high in velocity, diverse in variety, and, although the introduction of this last aspect by M3 IBM3 is rather disputable, problematic in terms of veracity (4V definition). According to Kitchin (2014b), the emerging literature presents Big Data as: (i) exhaustive in scope; (ii) fine-grained in resolution; (iii) relational in NATURE; (iv) flexible and scalable. Hence, he argued in another article (Kitchin, 2014a, p. 2) that the term “Big” is somewhat misleading, since Big Data are characterized by much more than a huge volume. National census data sets, for instance, are very large in size, are exhaustive, and have a fine resolution, but they lack velocity, variety, and flexibility",,
"Stough, Roger; McBride, Dennis",Big Data and US Public Policy,REVIEW OF POLICY RESEARCH,2014,339,"A working definition adopted for this paper and one that has informally evolved in practical as well as scholarly circles is: Big Data may be viewed as databases that are too large to be adequately handled by current spread sheet technologies. As such Big Data sets are viewed by some to have limited use for public policy as well as other analytical purposes because of their irregular and heterogeneity properties (Schintler, 2013). As a consequence they tend to be inherently biased and lead to a conclusion that contemporary statistical analysis routines are inadequate to examine them. Furthermore, they cannot be adequately visualized, and it is often difficult to understand what the analyst is working with. In short, there is a signal to noise problem: Big Data sets are inherently noisy and thus their signal quality is poor.",,
"Swanson, Maureen H.; Vogel, Kathleen M.","Big Data, intelligence, and analyst privacy: investigating information dissemination at an NSA-funded research lab",INTELLIGENCE AND NATIONAL SECURITY,2018,"357-358, 369 n. 1.","LAS has an interdisciplinary research focus on the science of Big Data, a term that refers to ‘the collection of large and complex data sets and the analysis of these data sets for relationships’ [1]. Big Data can be analyzed computationally, either individually or integrated with other data-sets, to reveal hidden or previously unknown patterns, trends, and associations. Big Data can be collected through either actively (e.g., posts on social media or other types of user-initiated responses) or passively (e.g., FitBit data). Typically, there are four characteristics associated with Big Data, often described as the four Vs: Volume, Variety, Velocity, and Veracity. Volume refers to the ability of Big Data to consist of large, and increasingly larger, volumes of data (terabytes, petabytes, or zettabytes). Variety refers to the ability to make sense of different sources and types of data, including structured (e.g., numbers, dates, and groups of words and numbers) and unstructured (e.g., text, video, audio, tweets) forms that can come from a wide variety of classified and unclassified sources, to include public and privately held sources (sensors, computers and other electronic devices, social networks, the Web, mobile phones). This data can consist of information that is solely digital in origin, as well as data that have been subsequently digitized. Velocity refers to the increasing frequency of incoming data that needs to be analyzed, and the speed at which it can be analyzed (millisecond, second, minute, hour, day, week, month). Veracity signifies the trustworthiness of the data. LAS Big Data research in particular aims to advance and improve intelligence analysis capabilities on US national security threats.
...

[1] EPIC (Electronic Privacy Information Center), “Big Data”. The MacKensey Global Institute expands this definition to note that:

“Big Data” refers to datasets whose size is beyond the ability of typical database software tools to capture, store, manage, and analyze. This definition is intentionally subjective and incorporates a moving definition of how big a data-set needs to be in order to be considered Big Data – i.e., we don’t define Big Data in terms of being larger than a certain number of terabytes (thousands of gigabytes). We assume that, as technology advances over time, the size of datasets that qualify as Big Data will also increase. Also note that the definition can vary by sector, depending on what kinds of software tools are commonly available and what sizes of datasets are common in a particular industry. With those caveats, Big Data in many sectors today will range from a few dozen terabytes to multiple petabytes (thousands of terabytes).",,
"Titiunik, Rocio",Can Big Data Solve the Fundamental Problem of Causal Inference?,PS-POLITICAL SCIENCE & POLITICS,2015,75,"The term “big data” may be ascribed various meanings. In their contribution to this symposium, Patty and Penn understand big data as a highly multidimensional and complex body of information that is not inherently ordered and that necessarily must go through a process of data reduction before it can be analyzed. In contrast, in the de?nitions of big data that I consider, “big data” refers to a rectangular array of information with n rows and p columns. Thus, my notion of big data as a rectangle presupposes that the reduction discussed by Patty and Penn already has occurred and that appropriate decisions have been made to transform complex, non-ordered data into variables that take particular values for each observation—decisions that, as Patty and Penn point out in this issue, can be crucially consequential.

Another view of big data, and one that Ashworth, Berry, and Bueno de Mesquita adopt in their contribution to this symposium, refers to the statistical and computational tools of machine learning that typically are used to “mine” or extract structured patterns of information from large datasets.2 Although this is a valuable de?nition for many purposes, I do not engage it directly because my argument centers on whether the access to vast amounts of new information per se will solve the most fundamental obstacles to causal inference, and I consider this question to be largely independent of the available techniques to detect and characterize empirical regularities in big datasets.3

Instead, my focus is on two other interpretations of big data: big data “as large n” and big data “as large p.” The former refers to data sources with several observations—that is, records collected for hundreds of thousands or millions of units of analysis. In this interpretation, big data represents a situation in which the number of observations, n, is extremely large relative to the number of variables available in the dataset. In contrast, the latter interpretation refers to the availability of a large amount of information per observation—that is, data sources in which the number of variables, p, is very large relative to n.",,
"Van Puyvelde, Damien; Coulthart, Stephen; Hossain, M. Shahriar",Beyond the buzzword: big data and national security decision-making,INTERNATIONAL AFFAIRS,2017,"1399,  1400-1403","To take stock of the diverse perspectives on the subject, we rely on the efforts of De Mauro and her colleagues to define big data through a survey of 1,581 conference papers and journal articles on the topic. The resulting definition considers big data to be ‘the information assets characterized by such a high volume, velocity and variety to require specific technology and analytical methods for its transformation into value’.

...

The characteristics of big data: volume, velocity, variety and veracity

--------------------------------------------------
The expression ‘big data’ is often understood as a set of very large datasets. But what exactly qualifies as a very large dataset? Volume is understood and processed differently in multiple fields and at different points in time. For a social scientist, a dataset including hundreds of thousands of entries may seem large, but would not appear so to a computer scientist. Similarly, while computer scientists might have considered a database of hundreds of thousands of entries to be very large in the early days of computing, today's researchers work with billions of entries. A 2010 study found that the amount of data produced globally was 1.2 zettabytes, or 1,200,000,000,000 trillion gigabytes. It is expected that by the year 2020 worldwide data production will reach 35 zettabytes.16 The desire and ability to process such large volumes of data constitute a significant component of the definition of big data, but volume alone is not sufficient to define big data.

Early definitions of big data describe how large amounts of data put heavy demands on computing power and resources, thus causing a ‘big data problem’.17 As the world keeps producing more and more data, this problem is still with us. Processing capabilities for all these data now lag behind storage capabilities. In other words, we have access to massive amounts of data but are not able to use them all.18 Volume, therefore, should be considered not in isolation, but in relation to the ability to store and process data. The definition of big data must comprehend not only numbers or volume, but the capacity to use these data. Following this approach, a common definition of big data describes ‘datasets whose size is beyond the analytical capacities of most database software tools’.19 One national security professional explains that ‘big data’ starts when Excel is not enough any more.20

The capacity to use data is challenged not only by increasingly large volumes of data, but also by data velocity. The speed at which new data are generated and change is increasing, which poses further storing and processing challenges. Twitter users, for instance, generate on average 6,000 tweets per second.21 To cope with the velocity of data generation, researchers and intelligence practitioners have sought to combine and simultaneously process multiple data streams. In one such project, the NSA combined data from ‘phone conversations, military events, road-traffic patterns, public opinion—even the price of potatoes’.22 In this case, automated data analysis partially replaced humans, who could not process all these data in a timely fashion. According to a former official with knowledge of the program, analysts found that introducing more data into the program also led to more accurate predictions of where insurgent attacks would occur.

The ‘big data problem’ is further complicated by the growing variety of data. In computer sciences, data are generally considered as alphanumeric characters and symbols that are stored, processed and transmitted. In recent decades, the variety of data available to researchers has exploded, and technology has provided the means to tap into new data sources. The proliferation of smartphones and wearable technology connected to the internet and equipped with audio and video sensors as well as GPS locators is only one example of how technological advances produce more and more diverse data. Humans and their environment have always produced data, for example biological and meteorological data, but a growing number of sensors now collect and store these data in ever greater quantity and higher quality. In addition, the advent of cyberspace has led to new types of data, generated by networks and the humans who use them. Surfing on the World Wide Web generates digital trails of data that can be accessed by social media sites such as Twitter and search engines such as Google. The computer networks that constitute the digital layer of cyberspace also generate data, for example in the form of web server logs.23 Each of these data types, some older than others, poses specific challenges related to their volume and velocity, thus contributing to the increasing variety of data available for analysis.

Researchers usually classify data in three categories: structured, semi-structured and unstructured. Structured data, as described by one writer, have been reformatted and ‘organized into a data structure so that elements can be addressed, organized and accessed in various combinations to make better use of the information’.24 In other words, structured data have been processed so that they are easily stored for retrieval and analysis. Examples of structured data include texts and numeric information that are stored in traditional relational databases, meaning the data can fit in rows and columns. Quantitative social scientists often use structured data in the form of Excel spreadsheets. Structured data are the least common type of data but the most commonly analysed.

Semi-structured data are the next most common type; these are harder to store and analyse than structured data. This type of data is structured in so far as each data-object is represented by a certain number of attributes. For example, a Microsoft Word document with headed sections conveys semi-structured data. While this document lacks the rigid organization of structured data, it contains a number of attributes, including chapters or section headings, tags informing users about the date of creation, and revisions of the document, which can help users organize and analyse it.25

Unstructured data are the fastest-growing category and the most widespread. They come in a variety of formats including audio, video, analogue data, books, images, web pages and more. The proliferation of social media platforms and personal devices has increased the amount of publicly available unstructured data. This type of data poses a significant challenge to data scientists both inside and outside modern intelligence agencies. The former chief technology officer for the Central Intelligence Agency (CIA) sums up the problem for the US intelligence community:

Our data is always fragmented, and we're trying to make sense of fragmented data options, which is extremely difficult … how we analyze every piece of data, how we reprocess it to continue to make better sense of what is going on—that is the biggest [challenge] we have, especially when we can't get complete databases.26

Large organizations, such as Google and multiple government intelligence agencies, increasingly rely on novel types of databases that can store a wide variety of data types from structured to unstructured, and organize them for subsequent analysis.

Veracity is another focal point in the discussion on big data and national security. This characteristic refers to ‘the biases, noise and abnormality in data’.27 In the national security context, more than in any other field, data and information should be approached sceptically because adversaries often actively alter data with the intention to deceive and mislead. National security professionals must question the representativeness and validity of data collected on social media, for instance.28 Questioning the veracity of data encourages the consumers of big data to consider whether the data that are being stored and mined are reliable and meaningful enough to help them answer the problems at hand.29 A classic example of how data veracity can affect national security decisions comes from Robert McNamara's tenure at the Pentagon during the Vietnam War. McNamara oversaw a large-scale effort to collect data on the US war effort in Vietnam. While the term ‘big data’ was not in use at the time, his team of ‘Whiz Kids’ applied statistical techniques honed in business in an attempt to understand the war and assess the effectiveness of US decisions. Ultimately, however, McNamara put undue confidence in key metrics that he used to assess the success of US efforts in Vietnam, in particular body-count data on the enemy. According to one general, these data were susceptible to being distorted by commanders who wanted to demonstrate their effectiveness.30 McNamara himself notes in his memoirs that data used by the US military were ‘inflated by the considerable falsification of data submitted by South Vietnamese officials’.31 A more recent example of intentional data manipulation is provided by Gary King and his colleagues, who estimate that the Chinese government fabricates 448 million social media posts a year.32 Given the volume and diversity of big data, this is an inherently noisy environment, which reinforces the difficulty in identifying signals—in this case, genuine posts.33 The risk, if the veracity of big datasets cannot be established, is that they will mislead analysts, and possibly decision-makers.",,
"Washington, Anne L.",Government Information Policy in the Era of Big Data,REVIEW OF POLICY RESEARCH,2014,319,"Big data describes diverse unstructured digital collections interwoven to discover patterns. Big data may also refer to earlier knowledge-discovery tools such as data mining, machine learning, and predictive analytics.",,
"White, Patricia; Breckenridge, R. Saylor","Trade-Offs, Limitations, and Promises of Big Data in Social Science Research",REVIEW OF POLICY RESEARCH,2014,333,"In the current world of social science, the qualities of data that make it “big” are more distinct than just a large sample size or population level data. In addition to size, “big data” also has the qualities of being one or more of the following: relational, aggregated, multilevel, and merged (RAMM). Relational data have embedded linkages between individuals and groups; aggregated data include data and variables that are combined from multiple sources and measures; multilevel data combine measures at both individual and group levels; and merged data are combined from different original sources.",,
"Yeung, Karen",Algorithmic regulation: A critical interrogation,REGULATION & GOVERNANCE,2018,505,"Although ""Big Data"" has been variously defined, I use the term to refer to the sociotechnical ensemble that utilizes a methodological technique that combines a technology (constituted by a configuration of information-processing hardware and software that can sift and sort vast quantities of data in very short times) with a process (through which algorithmic processes are applied to mine a large volume of digital data to find patterns and correlations within that data, distilling the patterns into predictive analytics, and applying the analytics to new data) (Cohen 2012, p. 1919). The excitement surrounding Big Data is rooted in its capacity to identify patterns and correlations that cannot be detected by human cognition, converting massive volumes of data ( often in unstructured form) into a particular, highly data-intensive form of knowledge, and thus creating a new mode of knowledge production (Cohen 2012, p. 1919).",,
