Authors,Article Name,Publication,Year,Definition Page(s),Definition,,
"Kernaghan, Kenneth","Digital dilemmas: Values, ethics and information technology",CANADIAN PUBLIC ADMINISTRATION-ADMINISTRATION PUBLIQUE DU CANADA,2014,300,"The Open Data movement is closely related to the Big Data (or Big Data analytics) movement dedicated to developing and exploiting data sets so large and complex that it is difficult to capture, store, manage and analyze them with typical database software.",,
"Kuiler, Erik W.",From Big Data to Knowledge: An Ontological Approach to Big Data Analytics,REVIEW OF POLICY RESEARCH,2014,311,"Following the Gartner Group’s definition, trade journals tend to emphasize three Big Data properties, collectively referenced as the three V’s :1 volume—to denote an exponentially large data set, ranging in size from one or more terabytes (1012) to multiple petabytes (1015) or exabytes (1018); velocity—to indicate data that arrive as continuous streams, rather than as transaction or database files; and variety—to designate data sets that contain both structured and unstructured data that may be subject to different semantics and in different formats, gathered from diverse sources. Discussing Big Data in its historical perspective, Jacobs (2009) offers a definition of the term that is perhaps more useful because it places Big Data in its proper IT context: “Big data should be defined at any point in time as ‘data whose size forces us to look beyond tried-and-true methods [of storage and manipulation] that are prevalent at that time.’”",,
"Lim, Kevjn",Big Data and Strategic Intelligence,INTELLIGENCE AND NATIONAL SECURITY,2016,621-622,"The term Big Data refers to massively voluminous, highly varied (i.e. structured and especially unstructured6 6 ‘Unstructured’ refers to data that are more complex to quantify such as photographs, video images, emails, text messages and so forth. Contemporary advances in automated analysis techniques, Bayesian-based machine learning and data mining allow for the datafication of such sources. According to one report, unstructured data make up over 90 per cent of the digital universe, see John Gantz and David Reinsel, ‘Extracting Value from Chaos’, IDC iView & EMC Corp. (June 2011) < http://www.emc.com/collateral/analyst-reports/idc-extracting-value-from-chaos-ar.pdf>. View all notes ) and dynamic real-time datasets that do not lend themselves to traditional relational data analysis processes. Instead, because of the orders of magnitude involved, the datasets are captured, ingested and interrogated across a number of servers and the results (of successive iterations) are re-aggregated afterwards in a procedure known as massive parallel processing (MPP) – the functional basis for Big Data analytics.

The key vector for the rise of Big Data is the digitization of information. In 2000, only a quarter of the world’s stored information was digital. In 2013, this figure rose to over 98 per cent of the approximately 1200 exabytes (1 exabyte equaling 1 billion gigabytes) of information stored 7 worldwide in all forms.7 But digitization is only a necessary, not sufficient condition for Big Data applications. What is still required is datafication that is the conversion of all structured, semi-structured and non-structured information packets into quantifiable units permitting the extraction of new forms of value.

",,
"Lin, Jimmy",On Building Better Mousetraps and Understanding the Human Condition: Reflections on Big Data in the Social Sciences,ANNALS OF THE AMERICAN ACADEMY OF POLITICAL AND SOCIAL SCIENCE,2015,35-36,"In the business context, big data are the (somewhat obvious) idea that an organization should retain data that result from carrying out its mission and exploit those data to generate insights for better decision-making. Also known as business intelligence, among other monikers, its origins date back several decades. In this sense, the big data hype is simply a rebranding of what many organizations have been doing for a long time. Today, these activities are known as data science and those who practice it are known as data scientists.

Examined more closely, however, there are three major trends that distinguish insight-generation activities today from, say, the 1990s. First, we have seen a tremendous explosion in the sheer amount of data—orders of magnitude increase. In the past, enterprises have typically focused on gathering data that are obviously valuable, such as business objects representing customers, items in catalogs, purchases, contracts, and so on. Today, in addition to such data, organizations also gather behavioral data from users. In the online setting, these include web pages that users visit and links that they click on, among others. The advent of social media and user-generated content, and the resulting interest in encouraging such interactions, further adds to the amount of data that is generated and collected. These are precisely the types of data that are valuable for computational social science.

Second, we see increasing sophistication in the types of analyses that organizations perform on their vast data stores. Traditionally, most information needs fell under what is known as online analytical processing (OLAP). Common tasks include creating joined views, followed by filtering, aggregation, or cube materialization— an example might be “show me the number of widgets sold in the northeast over the past six months to female customers.” We can characterize these activities as descriptive analytics, generating reports that an executive might consume. Today, data scientists are also interested in predictive analytics, which often involves building machine-learned models that can predict user behavior; for example, “what types of targeted ads can attract female customers to purchase this widget?” These models are then operationalized into data products that apply some sort of intervention (e.g., a recommender system) to hopefully affect user behavior. 

Finally, open-source software is playing an increasingly important role in today’s ecosystem. A decade ago, there was no credible open-source, distributed data analytics platform capable of handling large data volumes. Today, the open-source Hadoop platform, which began as an implementation of MapReduce (Dean and Ghemawat 2004), lies at the center of an ecosystem for large-scale data analytics, and is surrounded by complementary systems such as HBase, Pig, Hive, Spark, Giraph, and many others. Hadoop’s importance has been validated by its adoption in countless startups and mature enterprises. This broad base of support provides credibility, but the biggest impact of open-source infrastructure is the democratization of big data capabilities, especially when coupled with cloud computing. On-demand cloud services have obviated the need for many organizations to maintain dedicated hardware infrastructure, and today, analyses on terabytes of data can be conducted at modest costs without the need for major capital investments in servers. These tools are now within the reach of many social scientists, transforming the types of analyses they are able to conduct.",,
"Liu, Taoxiong; Xu, Xiaofei; Fan, Fangda",Forecasting Chinese GDP Using Online Data,EMERGING MARKETS FINANCE AND TRADE,2018,733,"Having a profound impact on social and economic development, the term big data refers to huge and diverse datasets (Ayi Armah 2013). The processing of these data extends beyond the abilities of current mainstream software, thereby requiring improvements in data processing tools.",,
"Longo, Justin; Dobell, Rod",The Limits of Policy Analytics: Early Examples and the Emerging Boundary of Possibilities,POLITICS AND GOVERNANCE,2018,6-7,"Definitions of ‘big data’ abound (Dutcher, 2014; Fredriksson, Mubarak, Tuohimaa, & Zhan, 2017; Ward & Barker, 2013), with most focusing on its characteristics— especially the large volume of data, its continuous flow at high velocity, and the variety of data available—and others pointing to the complexity of combined data sets and their value in revealing previously undetectable patterns. What emerges, however, from the policy analytics literature is a frequent conflation of ‘big data’ with ‘large’ data collections such as a census. While this reflects the current state of the art, our concept of big data draws especially on the velocity and variety (and, consequently, the large volume) of data as the foundation for a policy analytic approach that centres on a real-time understanding and interaction with the policy environment.",,
"Maciejewski, Mariusz","To do more, better, faster and more cheaply: using big data in public administration",INTERNATIONAL REVIEW OF ADMINISTRATIVE SCIENCES,2017,122-123,"There are several definitions of big data, ranging from the simple to the sophisticated. The simplest definition was formed by D. Laney, who described big data sets by their big volume, velocity and variety (Laney, 2001). This definition, while simple, is adequate for general purposes and is widely used (US Executive Office of the President, 2014). Fifteen years after this definition was proposed, datasets have become much bigger, more rapid and more varied. Almost everyone in modern society leaves digital traces of their lives, which may be gathered and may be available for easy processing and reasoning. The reasoning methods include aggregation of data, extraction, deduction, pattern detection, network analytics, trend evaluations, model creation, prediction and more. Methods of big data rely on applying certain reasoning to the above data sets with the help of computer technologies. In general, the core benefit of contemporary big data methods is that they allow for wide information input and intensive, automated analysis of that information. This allows an organization to manage and perform its duties significantly better, and even to execute tasks that would otherwise have been impossible. Successful application of big data methods results in:

1. A significant increase in the accuracy of decision-making, which occurs through:

a. The unprecedented expansion of the information database for analysing and drawing conclusions.

b. The feasibility of extensive work involving analysis and reasoning, which has been impossible to do with human resources alone.

c. The application of new methods of data presentation, allowing a better understanding of phenomena, changes over time and inter-relations.

d. The creation of algorithms to suggest appropriate solutions.

2. Significant acceleration of the performance of internal ‘information tasks’ through computerizing and automating data analysis and inference.

3. Significant reduction of the costs related to the decision-making process, thanks to the use of information technology rather than people to perform some or all of the analytical work and reasoning.

The opportunity to carry out tasks that were previously impossible is the consequence of the factors mentioned in points 1 and 2 above. To simplify: big data methods can uncover knowledge that was previously impossible to reveal. In turn, this new knowledge allows new tasks (previously impossible or even unimaginable) to be successfully carried out.",,
"Madsen, Anders Koed; Flyverbom, Mikkel; Hilbert, Martin; Ruppert, Evelyn",Big Data: Issues for an International Political Sociology of Data Practices,INTERNATIONAL POLITICAL SOCIOLOGY,2016,277,"Big data is a phenomenon that has been defined and conceptualized in various ways during the past five years ( De Mauro, Greco, and Grimaldi 2014 ). There is no consensus about what demarcates big data from other types of data, but a widely used definition has been Douglas Laney’s “3 v’s”:

Big data is high-volume, high-velocity, and/or high-variety information assets that require new forms of processing to enable enhanced decision-making, insight discovery, and process optimization ( Laney 2012 ).

According to Laney’s definition, big data practices are characterized by the technical attributes of the data they involve. Data points are numerous, and they come from various sources at a pace that is sometimes referred to as real time. This definition also entails that the problems raised by big data practices have technical solutions. For Laney, the pressing question is to find the right processing techniques to handle data with these new characteristics.

Writers such as Victor Meyer-Schönberger and Kenneth Cukier have challenged these largely technical definitions. Instead of focusing on the nature of data, they define big data with a focus on the new dynamics of knowledge production and valuation that are changed with the introduction of new data practices:

Big data refers to things one can do at a large scale that cannot be done at a smaller one, to extract new insights or create new forms of value, in ways that change markets, organizations, the relationship between citizens and governments, and more ( Mayer-Schönberger and Cukier 2013 ).

In line with our introductory comments above, we agree that the role of big data in transnational governance is not a purely technical phenomenon. It must be approached as a heterogeneous phenomenon that can be studied by attending to the interplay between social and technical relations in the way suggested by Meyer-Schönberger and Cukier. However, we want to add that this interplay can be fruitfully studied by attending to the following three moments of big data practices: 1) the datafication of daily life, 2) the production of patterns and predictions, and 3) the making of new modes of governance.",,
"Malomo, Fola; Sena, Vania",Data Intelligence for Local Government? Assessing the Benefits and Barriers to Use of Big Data in the Public Sector,POLICY AND INTERNET,2017,"7, 11, 12","It is now a popular byword for large volumes of data that are produced routinely by organizations and are too complex for standard software packages to process (Mayer- Schoenberger & Cukier, 2013).

...

The term Big Data emerged in the private sector around a decade ago, although there are earlier references to the concept (Laney, 2001). In reality, there is no agreed definition of Big Data. The most common one (Gartner, 2015) uses a series of Vs to describe the dimensions of Big Data:


Volume considers the amount of data generated and collected.
Velocity refers to the speed at which data are analyzed.
Variety indicates the different types of data that are collected.
Viscosity measures resistance to flow of data.
Variability measures the change of rate of flow
Veracity measures biases, noise, and abnormality.
Volatility indicates how long data are valid for and should be stored for.

However, there are additional features of Big Data that are essential to their nature and make them of interest. For instance, Manyika et al. (2011) use a subjective definition that emphasizes the size of the data sets being beyond the ability of typical database software tools to capture, store, manage, and analyze them. Other definitions focus on the fact that they can be of different types, and on the insights they can provide (Forbes, 2014).

...
As the variety of data produced by the public sector has grown, a few authors have pointed out that complexity—driven by the volume of data and the large number of data sources—is the defining feature of Big Data within the public sector (IBM, 2015) for several reasons (Sisense, 2013).",,
"Margetts, Helen",The Data Science of Politics,POLITICAL STUDIES REVIEW,2017,202-203,"Kitchin’s own definition of big data (Kitchin, 2014a, 2014b) is
more useful, laying out the distinguishing features of such data which allow new methodologies:

Huge in volume, consisting of terabytes or petabytes of data;

High in velocity, being created in or near real-time;

Diverse in variety, being structured and unstructured in nature;

Exhaustive in scope, striving to capture entire populations or systems (n?=?all);

Fine-grained in resolution and uniquely indexical in identification;

Relational in nature, containing common fields that enable the conjoining of different data sets;

Flexible, holding the traits of extensionality (can add new fields easily) and scaleability (can expand in size rapidly).",,
"McNeely, Connie L.; Hahm, Jong-on","The Big (Data) Bang: Policy, Prospects, and Challenges",REVIEW OF POLICY RESEARCH,2014,305,"In a pragmatic sense, big data has been used to describe datasets whose size is beyond the analytical capacities of most database software tools (Manyika et al., 2011), and the idea that things can be learned from a large body of data that cannot be comprehended from smaller amounts links big data to notions of complexity (cf. Kash & Rycroft, 2003). ",,
"Mergel, Ines; Rethemeyer, R. Karl; Isett, Kimberley",Big Data in Public Affairs,PUBLIC ADMINISTRATION REVIEW,2016,931,"Big data in public affairs, then, is high volume data that frequently combines highly structured administrative data actively collected by public sector organizations with continuously and automatically collected structured and unstructured real-time data that are often passively created by public and private entities through their Internet interactions.",,
"Miller, Peter V.",Is There a Future for Surveys?,PUBLIC OPINION QUARTERLY,2017,205 (ABSTRACT),...including administrative records and unstructured (“big”) data...,,
"Monroe, Burt L.; Pan, Jennifer; Roberts, Margaret E.; Sen, Maya; Sinclair, Betsy","No! Formal Theory, Causal Inference, and Big Data Are Not Contradictory Trends in Political Science",PS-POLITICAL SCIENCE & POLITICS,2015,71,"For us, the concept is broad and simultaneously captures several ideas. For us, the intuitive criterion—“lots of data”—is both unnecessary and insufficient. When referring to data qua data, “big” is defined relative to the computational or informational capacities of conventional approaches. Data can be big in many dimensions: observations (e.g., the US Census), covariates (e.g., gene sequences), file size (e.g., images), or network bandwidth (e.g., video) (Monroe 2013). Even “small” social data may contain interdependencies (e.g., networks, space-time, or hierarchy) that imply big models. The term also may describe the body of computational innovation that has become associated with such data, roughly equivalent to “data science” but need not imply the application of “data mining.” Among these innovations, we might list data collection (e.g., GPS tracking), data manipulation (e.g., web scraping), management (e.g., Hadoop), information extraction (e.g., natural language processing), or efficient computation (e.g., MapReduce), as well as the body of inferential techniques referred to variously as “statistical learning” or “machine learning.”",,
"Morris, Darcy Steeg",A Modeling Approach for Administrative Record Enumeration in the Decennial Census,PUBLIC OPINION QUARTERLY,2017,358,"The American Association for Public Opinion Research (AAPOR) considers administrative records to be big data because they are typically large in volume, “usually not designed by researchers,” and “generated for a different purpose and arise organically through administrative processes” (Japec et al. 2015).",,
"Patty, John W.; Penn, Elizabeth Maggie",Analyzing Big Data: Social Choice and Measurement,PS-POLITICAL SCIENCE & POLITICS,2015,95,"we begin by noting that empirical analysis of many interesting social science topics—and in particular those popularly associated with “big data” such as networks, text analysis, and genetics—always require data reduction. Data reduction is achieved through aggregating higher-dimensional data into lower-dimensional measures. In other words, we conceive of the “bigness” of data as a function of the data’s underlying conceptual structure. Much more than being a function of the number of observations or the number of variables, data is “big” if the concepts underlying the data—the data’s raison(s) d’être —are more complicated than a list of vectors of numbers. Social networks, texts, genomes, and brain scans all satisfy this requirement.",,
"Phillips, Fred",A perspective on 'Big Data',SCIENCE AND PUBLIC POLICY,2017,"730, 731","Today’s big data are popularly characterized by the first three Vs. Volumes and volumes of data. Instantaneous information on markets, metabolisms, and memes, and delivered to your PC or handheld in milliseconds, from naturally refrigerated server farms in Finland and under the Swiss Alps.

...

Bell (2014) rightly adds a fourth ‘v’ to the mix: validity. It is essential,
and difficult, to know whether the number in hand measures what it is supposed to measure.",,
"Pires, Sara Moreno; Magee, Liam; Holden, Meg",Learning from community indicators movements: Towards a citizen-powered urban data revolution,ENVIRONMENT AND PLANNING C-POLITICS AND SPACE,2017,1305,"The term “Big Data” is a simple sounding term that describes the massive accumulation of often apparently trivial information – public transport trips, social media tweets, local government payments and other mundane transactions that mark urban daily life. In aggregate, this data accumulation illustrates emergent patterns and trends, the digital “pulse” of the city. The volume, variety, veracity, and most of all, the velocity of this data revolution are taken to be both the effect and, increasingly, the cause of a city’s progress (IBM, 2015). This association of Big Data with rhetorics of success is supported by the acceleration of advanced levels of computing expertise that are required to manage, crunch and display these data flows. Technical experts exude varying levels of confidence that this pulse, if we develop the analytical tools to listen to it, can reveal secrets about cities, allowing greater predictability and ultimately controlling them from afar (Goldsmith and Crawford 2014; Kitchin, 2014; Sawyer, 2008).",,
"Poel, Martijn; Meyer, Eric T.; Schroeder, Ralph","Big Data for Policymaking: Great Expectations, but with Limited Progress?",POLICY AND INTERNET,2018,349,"The literature review, and the study as a whole, uses the following definition of Big Data: “Big Data is a step change in the scale and scope of the sources of materials (and tools for manipulating these sources) available in relation to a given object of interest” (Schroeder, 2014). This definition relates to a particular conception of “data,” whereby data belong to the objects investigated and they provide an “atomic” unit of analysis. This is a realist definition of data which highlights the scientific nature of data as evidence, with implications for debates about whether policy uses Big Data as evidence, or if not, for legitimating policies (which falls under the heading “policy?driven data” rather than the other way around, i.e., cherry?picking data to support a predetermined policy position, as suggested by our opening quote from Dickens, and which we discuss below), in which case its uses are not evidence based or scientific. In any event, this definition is more precise in the context of policymaking than the three or four “V's” which are often used in business and certain scientific contexts (Laney, 2001; Ward & Barker, 2013.), since not all efforts labeled as Big Data in the policy sphere entail high volume, velocity, variety and veracity, and also insofar as it focuses on the uses and applications of Big Data and focuses on the objects of interest to the researcher. Along the same lines, not all data sets are exhaustive in the sense of n?=?all.3",,
"Quintanilla, Gabriela; Gil-Garcia, Jose Ramon","Open Government and Linked Data: Concepts, Experiences and Lessons Based on the Mexican Case",REVISTA DEL CLAD REFORMA Y DEMOCRACIA,2016,75-76,"El término grandes datos se refiere a un gran conjunto complejo y cambiante de datos que crea nuevas formas de valor al cambiar los mercados, las organizaciones y las relaciones entre ciudadanos y Gobierno. Aprovechar los grandes datos implica la capacidad de analizar enormes cantidades de datos acerca de un tema (Mayer-Schönberger y Cukier, 2013).",,
