Author(s),Title,Source Title,Publication Year,Volume,Issue,Beginning Page,Ending Page,Number of Pages,DATABASE,DOI,"""Big Data"" in Title","""Big Data"" in Abstract","""Big Data"" in Keywords","""Big Data"" in Article Text","""Big Data"" in References",No Abstract,No Keywords,No References
"Adolf, Marian T.; Stehr, Nico","Information, Knowledge, and the Return of Social Physics",ADMINISTRATION & SOCIETY,2018,50,9,1238,1258,20,SSCI - PA,10.1177/0095399718760585,0,1,1,1,1,0,0,0
"Agarwal, P. K.",Public Administration Challenges in the World of AI and Bots,PUBLIC ADMINISTRATION REVIEW,2018,78,6,917,921,4,SSCI - PA,10.1111/puar.12979,0,1,0,0,0,0,1,0
"Agostino, Deborah; Arnaboldi, Michela",Social media data used in the measurement of public services effectiveness: Empirical evidence from Twitter in higher education institutions,PUBLIC POLICY AND ADMINISTRATION,2017,32,4,296,322,26,SSCI - PA,10.1177/0952076716682369,0,0,0,1,1,0,0,0
"Ansolabehere, Stephen; Hersh, Eitan",Validation: What Big Data Reveal About Survey Misreporting and the Real Electorate,POLITICAL ANALYSIS,2012,20,4,437,459,22,SSCI - PS,10.1093/pan/mps023,1,0,0,1,1,0,0,0
"Bachner, Jennifer; Hill, Kathy Wagner",Advances in Public Opinion and Policy Attitudes Research,POLICY STUDIES JOURNAL,2014,42,,51,70,19,"SSCI - PS,SSCI - PA",10.1111/psj.12052,0,0,1,1,0,0,0,0
"Beckman, Arthur",Political Marketing and Intellectual Autonomy,JOURNAL OF POLITICAL PHILOSOPHY,2018,26,1,24,46,22,SSCI - PS,10.1111/jopp.12126,0,1,1,1,1,0,0,0
"Belfry Munroe, Kaija; Munroe, H. D.",Constituency Campaigning in the Age of Data,CANADIAN JOURNAL OF POLITICAL SCIENCE-REVUE CANADIENNE DE SCIENCE POLITIQUE,2018,51,1,135,154,19,SSCI - PS,10.1017/S0008423917001135,0,1,0,1,1,0,0,0
"Bittner, Christian",OpenStreetMap in Israel and Palestine - 'Game changer' or reproducer of contested cartographies?,POLITICAL GEOGRAPHY,2017,57,,34,48,14,SSCI - PS,10.1016/j.polgeo.2016.11.010,0,0,0,0,1,0,0,0
"Blume, Grant; Scott, Tyler; Pirog, Maureen",Empirical Innovations in Policy Analysis,POLICY STUDIES JOURNAL,2014,42,,33,50,17,"SSCI - PS,SSCI - PA",10.1111/psj.12050,0,1,1,1,1,0,0,0
"Bonelli, Laurent; Ragazzi, Francesco","Low-tech security: Files, notes, and memos as technologies of anticipation",SECURITY DIALOGUE,2014,45,5,476,493,17,SSCI - IR,10.1177/0967010614545200,0,1,0,1,0,0,0,0
"Burscher, Bjorn; Vliegenthart, Rens; de Vreese, Claes H.",Using Supervised Machine Learning to Code Policy Issues: Can Classifiers Generalize across Contexts?,ANNALS OF THE AMERICAN ACADEMY OF POLITICAL AND SOCIAL SCIENCE,2015,659,1,122,131,0,SSCI - PS,10.1177/0002716215569441,0,0,1,0,0,0,0,0
"Campbell-Verduyn, Malcolm; Goguen, Marcel; Porter, Tony",Big Data and algorithmic governance: the case of financial practices,NEW POLITICAL ECONOMY,2017,22,2,219,236,17,"SSCI - PS,SSCI - IR",10.1080/13563467.2016.1216533,1,1,1,1,1,0,0,0
"Ceron, Andrea; Curini, Luigi",e-Campaigning in the 2014 European elections: The emphasis on valence issues in a two-dimensional multiparty system,PARTY POLITICS,2018,24,2,105,117,12,SSCI - PS,10.1177/1354068816642807,0,0,0,0,1,0,0,0
"Ceron, Andrea; Negri, Fedra",The Social Side of Public Policy: Monitoring Online Public Opinion and Its Mobilization During the Policy Cycle,POLICY AND INTERNET,2016,8,2,131,147,16,SSCI - PS,10.1002/poi3.117,0,1,0,1,1,0,0,0
"Chandler, David","How the World Learned to Stop Worrying and Love Failure: Big Data, Resilience and Emergent Causality",MILLENNIUM-JOURNAL OF INTERNATIONAL STUDIES,2016,44,3,391,410,19,SSCI - IR,10.1177/0305829816636673,1,0,1,1,1,0,0,0
"Chandler, David",A World without Causation: Big Data and the Coming of Age of Posthumanism,MILLENNIUM-JOURNAL OF INTERNATIONAL STUDIES,2015,43,3,833,851,18,SSCI - IR,10.1177/0305829815576817,1,1,1,1,1,0,0,0
"Choi, SetByol; Kim, Su Jung; Lee, Myoung-Jin","A Cultural Map of South Korea, 2011",KOREA OBSERVER,2017,48,3,549,575,26,SSCI - IR,,0,1,0,1,0,0,0,0
"Clark, William Roberts; Golder, Matt","Big Data, Causal Inference, and Formal Theory: Contradictory Trends in Political Science?",PS-POLITICAL SCIENCE & POLITICS,2015,48,1,65,70,5,SSCI - PS,10.1017/S1049096514001759,1,0,0,1,1,1,1,0
"Clarke, Amanda; Craft, Jonathan",The vestiges and vanguards of policy design in a digital context,CANADIAN PUBLIC ADMINISTRATION-ADMINISTRATION PUBLIQUE DU CANADA,2017,60,4,476,497,21,SSCI - PA,10.1111/capa.12228,0,1,1,1,1,0,0,0
"Cobb, Wendy N. Whitman",Trending now: Using big data to examine public opinion of space policy,SPACE POLICY,2015,32,,11,16,5,SSCI - IR,10.1016/j.spacepol.2015.02.008,1,1,1,1,1,0,0,0
"Conway, Maura",Determining the Role of the Internet in Violent Extremism and Terrorism: Six Suggestions for Progressing Research,STUDIES IN CONFLICT & TERRORISM,2017,40,1,77,98,21,"SSCI - PS,SSCI - IR",10.1080/1057610X.2016.1157408,0,1,0,1,1,0,1,0
"Crosas, Merce; King, Gary; Honaker, James; Sweeney, Latanya",Automating Open Science for Big Data,ANNALS OF THE AMERICAN ACADEMY OF POLITICAL AND SOCIAL SCIENCE,2015,659,1,260,273,13,SSCI - PS,10.1177/0002716215570847,1,1,1,1,1,0,0,0
"Cukier, Kenneth; Mayer-Schoenberger, Viktor",The Rise of Big Data How It's Changing the Way We Think About the World,FOREIGN AFFAIRS,2013,92,3,28,40,NaN,SSCI - IR,,1,0,0,1,0,1,1,1
"Dean, Mitchell",Three Forms of Democratic Political Acclamation,TELOS,2017,,179,9,32,23,SSCI - PS,,0,0,1,1,1,1,0,0
"Desouza, Kevin C.; Jacob, Benoy",Big Data in the Public Sector: Lessons for Practitioners and Scholars,ADMINISTRATION & SOCIETY,2017,49,7,1043,1064,21,SSCI - PA,10.1177/0095399714555751,1,1,1,1,1,0,0,0
"Dowding, Keith",So Much to Say: Response to Commentators,POLITICAL STUDIES REVIEW,2017,15,2,217,230,13,SSCI - PS,10.1177/1478929917693645,0,1,0,1,1,0,0,0
"Durrant, Hannah; Barnett, Julie; Rempel, Emily Suzanne",Realising the Benefits of Integrated Data for Local Policymaking: Rhetoric versus Reality,POLITICS AND GOVERNANCE,2018,6,4,18,28,10,SSCI - PS,10.17645/pag.v6i4.1586,0,1,1,1,1,0,0,0
"Eldridge, Christopher; Hobbs, Christopher; Moran, Matthew",Fusing algorithms and analysts: open-source intelligence in the age of 'Big Data',INTELLIGENCE AND NATIONAL SECURITY,2018,33,3,391,406,15,"SSCI - PS,SSCI - IR",10.1080/02684527.2017.1406677,1,1,0,1,1,0,1,0
"Ellen, Ingrid Gould; Horn, Keren Mertens; Schwartz, Amy Ellen",Why Don't Housing Choice Voucher Recipients Live Near Better Schools? Insights from Big Data,JOURNAL OF POLICY ANALYSIS AND MANAGEMENT,2016,35,4,884,905,NaN,SSCI - PA,10.1002/pam.21929,1,0,0,0,0,0,0,0
"Endres, Kyle",The Accuracy of Microtargeted Policy Positions,PS-POLITICAL SCIENCE & POLITICS,2016,49,4,771,774,3,SSCI - PS,10.1017/S1049096516001645,0,0,1,1,1,0,0,0
"Enos, Ryan D.; Fowler, Anthony",Aggregate Effects of Large-Scale Campaigns on Voter Turnout,POLITICAL SCIENCE RESEARCH AND METHODS,2018,6,4,733,751,18,SSCI - PS,10.1017/psrm.2016.21,0,0,1,0,1,0,0,0
"Entwisle, Barbara; Hofferth, Sandra L.; Moran, Emilio F.",Quilting a Time-Place Mosaic: Concluding Remarks,ANNALS OF THE AMERICAN ACADEMY OF POLITICAL AND SOCIAL SCIENCE,2017,669,1,190,198,8,SSCI - PS,10.1177/0002716216683698,0,1,1,1,0,0,0,0
"Fast, Larissa",Diverging Data: Exploring the Epistemologies of Data Collection and Use among Those Working on and in Conflict,INTERNATIONAL PEACEKEEPING,2017,24,5,706,732,26,SSCI - IR,10.1080/13533312.2017.1383562,0,1,0,1,1,0,0,0
"Fierascu, Silvia I.; Parvu, Mihai; Topirceanu, Alexandru; Udrescu, Mihai",Exploring Party Switching in the Post-1989 Romanian Politicians Network from a Complex Network Perspective,ROMANIAN JOURNAL OF POLITICAL SCIENCE,2018,18,1,108,136,28,SSCI - PS,,0,1,0,0,0,0,0,0
"Fourcade, Marion; Healy, Kieran",Seeing like a market,SOCIO-ECONOMIC REVIEW,2017,15,1,9,29,20,SSCI - PS,10.1093/ser/mww033,0,0,1,1,1,0,0,0
"Gabay, Clive; Ilcan, Suzan","The Affective Politics of the Sustainable Development Goals: Partnership, Capacity-Building, and Big Data",GLOBALIZATIONS,2017,14,3,468,485,17,SSCI - IR,10.1080/14747731.2017.1286167,1,1,1,1,1,0,0,0
"Gale, Fred; Ascui, Francisco; Lovell, Heather",Sensing Reality? New Monitoring Technologies for Global Sustainability Standards,GLOBAL ENVIRONMENTAL POLITICS,2017,17,2,65,83,18,"SSCI - PS,SSCI - IR",10.1162/GLEP_a_00401,0,1,0,1,1,0,0,0
"Gamage, Pandula",New development: Leveraging big data' analytics in the public sector,PUBLIC MONEY & MANAGEMENT,2016,36,5,385,390,5,SSCI - PA,10.1080/09540962.2016.1194087,1,1,1,1,1,0,0,0
"Garcia, David; Mavrodiev, Pavlin; Casati, Daniele; Schweitzer, Frank","Understanding Popularity, Reputation, and Social Influence in the Twitter Society",POLICY AND INTERNET,2017,9,3,343,364,21,SSCI - PS,10.1002/poi3.151,0,0,0,0,1,0,0,0
"Giest, Sarah",Big data for policymaking: fad or fasttrack?,POLICY SCIENCES,2017,50,3,367,382,15,SSCI - PA,10.1007/s11077-017-9293-1,1,1,1,1,1,0,0,0
"Gorham, Ashley E.",Big Data and Democracy: Facts and Values,PS-POLITICAL SCIENCE & POLITICS,2017,50,4,958,961,3,SSCI - PS,10.1017/S104909651700107X,1,1,0,1,1,0,0,0
"Goroff, Daniel; Polonetsky, Jules; Tene, Omer",Privacy Protective Research: Facilitating Ethically Responsible Access to Administrative Data,ANNALS OF THE AMERICAN ACADEMY OF POLITICAL AND SOCIAL SCIENCE,2018,675,1,46,66,20,SSCI - PS,10.1177/0002716217742605,0,0,1,1,1,0,0,0
"Grimmer, Justin","We Are All Social Scientists Now: How Big Data, Machine Learning, and Causal Inference Work Together",PS-POLITICAL SCIENCE & POLITICS,2015,48,1,80,83,3,SSCI - PS,10.1017/S1049096514001784,1,0,0,1,1,1,0,0
"Guerrero, Omar A.; Lopez, Eduardo",Understanding Unemployment in the Era of Big Data: Policy Informed by Data-Driven Theory,POLICY AND INTERNET,2017,9,1,28,54,26,SSCI - PS,10.1002/poi3.136,1,1,1,1,1,0,0,0
"Guggenheim, Lauren; Jang, S. Mo; Bae, Soo Young; Neuman, W. Russell",The Dynamics of Issue Frame Competition in Traditional and Social Media,ANNALS OF THE AMERICAN ACADEMY OF POLITICAL AND SOCIAL SCIENCE,2015,659,1,207,224,17,SSCI - PS,10.1177/0002716215570549,0,0,1,1,1,0,0,0
"Hansen, Hans Krause; Porter, Tony",What Do Big Data Do in Global Governance?,GLOBAL GOVERNANCE,2017,23,1,31,42,11,SSCI - IR,,1,1,1,1,1,0,0,0
"Hargittai, Eszter",Is Bigger Always Better? Potential Biases of Big Data Derived from Social Network Sites,ANNALS OF THE AMERICAN ACADEMY OF POLITICAL AND SOCIAL SCIENCE,2015,659,1,63,76,13,SSCI - PS,10.1177/0002716215570866,1,1,1,1,1,0,0,0
"Heath-Kelly, Charlotte",Algorithmic autoimmunity in the NHS: Radicalisation and the clinic,SECURITY DIALOGUE,2017,48,1,29,45,16,SSCI - IR,10.1177/0967010616671642,0,1,0,1,1,0,0,0
"Hesse, Bradford W.; Moser, Richard P.; Riley, William T.",From Big Data to Knowledge in the Social Sciences,ANNALS OF THE AMERICAN ACADEMY OF POLITICAL AND SOCIAL SCIENCE,2015,659,1,16,32,16,SSCI - PS,10.1177/0002716215570007,1,1,1,1,1,0,0,0
"Hindman, Matthew","Building Better Models: Prediction, Replication, and Machine Learning in the Social Sciences",ANNALS OF THE AMERICAN ACADEMY OF POLITICAL AND SOCIAL SCIENCE,2015,659,1,48,62,14,SSCI - PS,10.1177/0002716215570279,0,1,1,1,0,0,0,0
"Hofferth, Sandra L.; Moran, Emilio F.; Entwisle, Barbara; Aber, J. Lawrence; Brady, Henry E.; Conley, Dalton; Cutter, Susan L.; Eckel, Catherine C.; Hamilton, Darrick; Hubacek, Klaus",Introduction: History and Motivation,ANNALS OF THE AMERICAN ACADEMY OF POLITICAL AND SOCIAL SCIENCE,2017,669,1,6,17,11,SSCI - PS,10.1177/0002716216682715,0,1,1,1,1,0,0,0
"Honavar, Vasant G.",The Promise and Potential of Big Data: A Case for Discovery Informatics,REVIEW OF POLICY RESEARCH,2014,31,4,326,330,4,"SSCI - PS,SSCI - PA",10.1111/ropr.12080,1,1,1,1,1,0,0,0
"Hondula, David M.; Kuras, Evan R.; Longo, Justin; Johnston, Erik W.",Toward precision governance: infusing data into public management of environmental hazards,PUBLIC MANAGEMENT REVIEW,2018,20,5,746,765,19,SSCI - PA,10.1080/14719037.2017.1320043,0,0,0,1,1,0,0,0
"Jaeger, Kai",NOT A NEW GOLD STANDARD: EVEN BIG DATA CANNOT PREDICT THE FUTURE,CRITICAL REVIEW,2016,28,03-Apr,335,355,20,SSCI - PS,10.1080/08913811.2016.1237704,1,1,1,1,0,0,0,0
"Japec, Lilli; Kreuter, Frauke; Berg, Marcus; Biemer, Paul; Decker, Paul; Lampe, Cliff; Lane, Julia; O'Neil, Cathy; Usher, Abe",Big Data in Survey Research,PUBLIC OPINION QUARTERLY,2015,79,4,839,880,41,SSCI - PS,10.1093/poq/nfv039,1,1,0,1,1,0,0,0
"Jensen, Michael J.; Bang, Henrik",Digitally networked movements as problematization and politicization,POLICY STUDIES,2015,36,6,573,589,16,SSCI - PA,10.1080/01442872.2015.1095879,0,0,1,0,0,0,0,0
"Johnson, Peter; Robinson, Pamela","Civic Hackathons: Innovation, Procurement, or Civic Engagement?",REVIEW OF POLICY RESEARCH,2014,31,4,349,357,8,"SSCI - PS,SSCI - PA",10.1111/ropr.12074,0,0,1,0,0,0,0,0
"Johnston, Ron; Manley, David; Jones, Kelvyn; Hoare, Anthony; Harris, Richard",British educational trajectories from school to university: evaluating quantitative evidence in policy formulation and justification,POLICY AND POLITICS,2017,45,2,137,155,18,"SSCI - PS,SSCI - PA",10.1332/030557316X14598535404750,0,1,0,1,1,0,0,0
"Jost, John T.; Barbera, Pablo; Bonneau, Richard; Langer, Melanie; Metzger, Megan; Nagler, Jonathan; Sterling, Joanna; Tucker, Joshua A.","How Social Media Facilitates Political Protest: Information, Motivation, and Social Networks",POLITICAL PSYCHOLOGY,2018,39,,85,118,33,SSCI - PS,10.1111/pops.12478,0,1,0,0,1,0,0,0
"Jun, Sunghae; Park, Sangsung; Jang, Dongsik",A Technology Valuation Model Using Quantitative Patent Analysis: A Case Study of Technology Transfer in Big Data Marketing,EMERGING MARKETS FINANCE AND TRADE,2015,51,5,963,974,11,SSCI - IR,10.1080/1540496X.2015.1061387,1,1,1,1,0,0,0,0
"Kernaghan, Kenneth","Digital dilemmas: Values, ethics and information technology",CANADIAN PUBLIC ADMINISTRATION-ADMINISTRATION PUBLIQUE DU CANADA,2014,57,2,295,317,22,SSCI - PA,10.1111/capa.12069,0,1,0,1,1,0,0,0
"Kuiler, Erik W.",From Big Data to Knowledge: An Ontological Approach to Big Data Analytics,REVIEW OF POLICY RESEARCH,2014,31,4,311,318,7,"SSCI - PS,SSCI - PA",10.1111/ropr.12077,1,1,1,1,1,0,0,0
"Landman, Todd","Democracy and Human Rights: Concepts, Measures, and Relationships",POLITICS AND GOVERNANCE,2018,6,1,48,59,11,SSCI - PS,10.17645/pag.v6i1.1186,0,0,1,1,0,0,0,0
"Lavertu, Stephane",We All Need Help: Big Data and the Mismeasure of Public Administration,PUBLIC ADMINISTRATION REVIEW,2016,76,6,864,872,8,SSCI - PA,10.1111/puar.12436,1,1,0,1,1,0,0,0
"Lee, Chien-Pang",Reduced the Risk in Agriculture Management for Government Using Support Vector Regression with Dynamic Optimization Parameters,LEX LOCALIS-JOURNAL OF LOCAL SELF-GOVERNMENT,2017,15,2,243,261,18,"SSCI - PS,SSCI - PA",10.4335/15.2.243-261(2017),0,1,1,1,0,0,0,0
"Lee, Seorim",Space at your fingertips: Assessing the public's interest in space activities,SPACE POLICY,2015,34,,39,46,7,SSCI - IR,10.1016/j.spacepol.2015.04.003,0,0,1,1,0,0,0,0
"Lee, Yong-joon; Kwon, Hyuk-jin; Lee, Jae-il; Shin, Dong-kyoo",The Countermeasure Strategy Based on Big Data against North Korean Cyber-attacks,KOREAN JOURNAL OF DEFENSE ANALYSIS,2018,30,3,437,454,17,SSCI - IR,,1,1,1,1,1,0,0,0
"Lim, Kevjn",Big Data and Strategic Intelligence,INTELLIGENCE AND NATIONAL SECURITY,2016,31,4,619,635,16,"SSCI - PS,SSCI - IR",10.1080/02684527.2015.1062321,1,1,0,1,1,0,1,0
"Lin, Jimmy",On Building Better Mousetraps and Understanding the Human Condition: Reflections on Big Data in the Social Sciences,ANNALS OF THE AMERICAN ACADEMY OF POLITICAL AND SOCIAL SCIENCE,2015,659,1,33,47,14,SSCI - PS,10.1177/0002716215569174,1,1,1,1,1,0,0,0
"Liu, Shuhua Monica; Yuan, Qianli",The Evolution of Information and Communication Technology in Public Administration,PUBLIC ADMINISTRATION AND DEVELOPMENT,2015,35,2,140,151,11,SSCI - PA,10.1002/pad.1717,0,1,0,1,0,0,0,0
"Liu, Taoxiong; Xu, Xiaofei; Fan, Fangda",Forecasting Chinese GDP Using Online Data,EMERGING MARKETS FINANCE AND TRADE,2018,54,4,733,746,13,SSCI - IR,10.1080/1540496X.2016.1216841,0,1,0,1,1,0,0,0
"Loewen, Peter John; Heroux-Legault, Maxime; de Miguel, Carolina",Nationalism and ethnic heterogeneity: The importance of local context for nationalist party vote choice,ELECTORAL STUDIES,2015,39,,129,141,12,SSCI - PS,10.1016/j.electstud.2015.04.005,0,0,1,0,0,0,0,0
"Longo, Justin; Dobell, Rod",The Limits of Policy Analytics: Early Examples and the Emerging Boundary of Possibilities,POLITICS AND GOVERNANCE,2018,6,4,5,17,12,SSCI - PS,10.17645/pag.v6i4.1561,0,1,1,1,1,0,0,0
"Longo, Justin; Kuras, Evan; Smith, Holly; Hondula, David M.; Johnston, Erik","Technology Use, Exposure to Natural Hazards, and Being Digitally Invisible: Implications for Policy Analytics",POLICY AND INTERNET,2017,9,1,76,108,32,SSCI - PS,10.1002/poi3.144,0,0,0,1,1,0,0,0
"Ma, Yukun; Xu, Bin; Xu, Xiaofei",Real Estate Confidence Index Based on Real Estate News,EMERGING MARKETS FINANCE AND TRADE,2018,54,4,747,760,13,SSCI - IR,10.1080/1540496X.2016.1232193,0,1,0,1,0,0,0,0
"Maciejewski, Mariusz","To do more, better, faster and more cheaply: using big data in public administration",INTERNATIONAL REVIEW OF ADMINISTRATIVE SCIENCES,2017,83,,120,135,15,SSCI - PA,10.1177/0020852316640058,1,1,1,1,1,0,0,0
"Madsen, Anders Koed; Flyverbom, Mikkel; Hilbert, Martin; Ruppert, Evelyn",Big Data: Issues for an International Political Sociology of Data Practices,INTERNATIONAL POLITICAL SOCIOLOGY,2016,10,3,275,296,21,"SSCI - PS,SSCI - IR",10.1093/ips/olw010,1,1,0,1,1,0,0,0
"Malomo, Fola; Sena, Vania",Data Intelligence for Local Government? Assessing the Benefits and Barriers to Use of Big Data in the Public Sector,POLICY AND INTERNET,2017,9,1,7,27,20,SSCI - PS,10.1002/poi3.141,1,1,1,1,1,0,0,0
"Margetts, Helen",The Data Science of Politics,POLITICAL STUDIES REVIEW,2017,15,2,201,209,8,SSCI - PS,10.1177/1478929917693643,0,0,1,1,1,0,0,0
"Mattingly-Jordan, Sara",Reasserting the Refounding,ADMINISTRATION & SOCIETY,2018,50,5,653,678,25,SSCI - PA,10.1177/0095399718770392,0,0,1,1,1,0,0,0
"McNeely, Connie L.; Hahm, Jong-on","The Big (Data) Bang: Policy, Prospects, and Challenges",REVIEW OF POLICY RESEARCH,2014,31,4,304,310,6,"SSCI - PS,SSCI - PA",10.1111/ropr.12082,1,1,1,1,1,0,0,0
"Mergel, Ines",Building Holistic Evidence for Social Media Impact,PUBLIC ADMINISTRATION REVIEW,2017,77,4,489,495,6,SSCI - PA,10.1111/puar.12780,0,0,1,1,1,0,0,0
"Mergel, Ines; Rethemeyer, R. Karl; Isett, Kimberley",Big Data in Public Affairs,PUBLIC ADMINISTRATION REVIEW,2016,76,6,928,937,9,SSCI - PA,10.1111/puar.12625,1,1,0,1,1,0,0,0
"Miller, Peter V.",Is There a Future for Surveys?,PUBLIC OPINION QUARTERLY,2017,81,,205,212,7,SSCI - PS,10.1093/poq/nfx008,0,1,0,1,0,0,0,0
"Monroe, Burt L.; Pan, Jennifer; Roberts, Margaret E.; Sen, Maya; Sinclair, Betsy","No! Formal Theory, Causal Inference, and Big Data Are Not Contradictory Trends in Political Science",PS-POLITICAL SCIENCE & POLITICS,2015,48,1,71,74,3,SSCI - PS,10.1017/S1049096514001760,1,0,0,1,1,1,1,0
"Montgomery, Jacob M.; Olivella, Santiago",Tree-Based Models for Political Science Data,AMERICAN JOURNAL OF POLITICAL SCIENCE,2018,62,3,729,744,15,SSCI - PS,10.1111/ajps.12361,0,1,0,1,1,0,0,0
"Mooney, Pat",What's cooking for climate change? Techno-fixing dinner for 10 billion,BULLETIN OF THE ATOMIC SCIENTISTS,2018,74,6,390,396,6,SSCI - IR,10.1080/00963402.2018.1533214,0,1,1,1,1,0,0,0
"Morehouse, Matthew Alan; Lovecky, Tomas; Read, Hannah; Woodman, Marcus","Quantify? or, Wanna Cry? Integrating Methods Training in the IR Classroom",INTERNATIONAL STUDIES PERSPECTIVES,2017,18,2,225,245,20,SSCI - IR,10.1093/isp/ekv012,0,1,0,1,1,0,0,0
"Morris, Darcy Steeg",A Modeling Approach for Administrative Record Enumeration in the Decennial Census,PUBLIC OPINION QUARTERLY,2017,81,,357,384,27,SSCI - PS,10.1093/poq/nfw059,0,1,0,1,1,0,1,0
"Mugge, Liza; Evans, Elizabeth; Engeli, Isabelle",introduction: gender in european political science education - taking stock and future directions,EUROPEAN POLITICAL SCIENCE,2016,15,3,281,291,10,SSCI - PS,10.1057/eps.2015.72,0,1,0,0,0,0,0,0
"Mutlu, Can E.","Of Algorithms, Data and Ethics: A Response to Andrew Bennett",MILLENNIUM-JOURNAL OF INTERNATIONAL STUDIES,2015,43,3,998,1002,4,SSCI - IR,10.1177/0305829815581536,0,1,0,1,0,0,0,0
"Nagler, Jonathan; Tucker, Joshua A.",Drawing Inferences and Testing Theories with Big Data,PS-POLITICAL SCIENCE & POLITICS,2015,48,1,84,88,4,SSCI - PS,10.1017/S1049096514001796,1,0,0,1,0,1,1,0
"Neo, Rachel L.",Favoritism or Animosity? Examining How SNS Network Homogeneity Influences Vote Choice via Affective Mechanisms,INTERNATIONAL JOURNAL OF PUBLIC OPINION RESEARCH,2016,28,4,461,483,22,SSCI - PS,10.1093/ijpor/edv035,0,0,1,0,1,0,0,0
"O'Donnell, Matthew Brook; Falk, Emily B.",Big Data under the Microscope and Brains in Social Context: Integrating Methods from Computational Social Science and Neuroscience,ANNALS OF THE AMERICAN ACADEMY OF POLITICAL AND SOCIAL SCIENCE,2015,659,1,274,289,15,SSCI - PS,10.1177/0002716215569446,1,0,1,1,1,0,0,0
"Patty, John W.; Penn, Elizabeth Maggie",Analyzing Big Data: Social Choice and Measurement,PS-POLITICAL SCIENCE & POLITICS,2015,48,1,95,101,6,SSCI - PS,10.1017/S1049096514001814,1,0,0,1,1,1,0,0
"Phillips, Fred",A perspective on 'Big Data',SCIENCE AND PUBLIC POLICY,2017,44,5,730,737,7,SSCI - PA,10.1093/scipol/scx012,1,1,1,1,1,0,0,0
"Phillips, Trevor; Webber, Richard",Superdiversity and the Browning of Labour,POLITICAL QUARTERLY,2014,85,3,304,311,7,SSCI - PS,10.1111/1467-923X.12100,0,1,0,0,0,0,0,0
"Pires, Sara Moreno; Magee, Liam; Holden, Meg",Learning from community indicators movements: Towards a citizen-powered urban data revolution,ENVIRONMENT AND PLANNING C-POLITICS AND SPACE,2017,35,7,1304,1323,19,SSCI - PA,10.1177/2399654417691512,0,0,1,1,1,0,0,0
"Poel, Martijn; Meyer, Eric T.; Schroeder, Ralph","Big Data for Policymaking: Great Expectations, but with Limited Progress?",POLICY AND INTERNET,2018,10,3,347,367,20,SSCI - PS,10.1002/poi3.176,1,1,1,1,1,0,0,0
"Quintanilla, Gabriela; Gil-Garcia, Jose Ramon","Open Government and Linked Data: Concepts, Experiences and Lessons Based on the Mexican Case",REVISTA DEL CLAD REFORMA Y DEMOCRACIA,2016,,65,69,102,33,"SSCI - PS,SSCI - PA",,0,1,0,1,1,0,0,0
"Richards, David; Smith, Martin J.",In Defence of British Politics Against the British Political Tradition,POLITICAL QUARTERLY,2015,86,1,41,51,10,SSCI - PS,10.1111/1467-923X.12137,0,1,0,1,0,0,0,0
"Rogge, Nicky; Agasisti, Tommaso; De Witte, Kristof",Big data and the measurement of public organizations' performance and efficiency: The state-of-the-art,PUBLIC POLICY AND ADMINISTRATION,2017,32,4,263,281,18,SSCI - PA,10.1177/0952076716687355,1,1,1,1,1,0,0,0
"Rothe, Delf",Seeing like a satellite: Remote sensing and the ontological politics of environmental security,SECURITY DIALOGUE,2017,48,4,334,353,19,SSCI - IR,10.1177/0967010617709399,0,0,1,1,1,0,0,0
"Roy, Jeffrey","Secrecy, Security and Digital Literacy in an Era of Meta-Data: Why the Canadian Westminster Model Falls Short",INTELLIGENCE AND NATIONAL SECURITY,2016,31,1,95,117,22,"SSCI - PS,SSCI - IR",10.1080/02684527.2014.941250,0,1,0,1,1,0,1,0
"Rumson, Alexander G.; Hallett, Stephen H.; Brewer, Timothy R.",Coastal risk adaptation: the potential role of accessible geospatial Big Data,MARINE POLICY,2017,83,,100,110,10,SSCI - IR,10.1016/j.marpol.2017.05.032,1,1,1,1,1,0,0,0
"Schintler, Laurie A.; Kulkarni, Rajendra","Big Data for Policy Analysis: The Good, The Bad, and The Ugly",REVIEW OF POLICY RESEARCH,2014,31,4,343,348,5,"SSCI - PS,SSCI - PA",10.1111/ropr.12079,1,1,1,1,1,0,0,0
"Schneider, Gerald",Peace through globalization and capitalism? Prospects of two liberal propositions,JOURNAL OF PEACE RESEARCH,2014,51,2,173,183,10,"SSCI - PS,SSCI - IR",10.1177/0022343313497739,0,1,0,1,0,0,0,0
"Schober, Michael F.; Pasek, Josh; Guggenheim, Lauren; Lampe, Cliff; Conrad, Frederick G.",Research Synthesis: Social Media and Social Measurement,PUBLIC OPINION QUARTERLY,2016,80,1,180,211,31,SSCI - PS,10.1093/poq/nfv048,0,0,1,1,1,0,0,0
"Schwarz, Jonas Andersson",Platform Logic: An Interdisciplinary Approach to the Platform-Based Economy,POLICY AND INTERNET,2017,9,4,374,394,20,SSCI - PS,10.1002/poi3.159,0,0,1,1,1,0,0,0
"Severo, Marta; Feredj, Amel; Romele, Alberto",Soft Data and Public Policy: Can Social Media Offer Alternatives to Official Statistics in Urban Policymaking?,POLICY AND INTERNET,2016,8,3,354,372,18,SSCI - PS,10.1002/poi3.127,0,1,1,1,1,0,0,0
"Shah, Dhavan V.; Cappella, Joseph N.; Neuman, W. Russell","Big Data, Digital Media, and Computational Social Science: Possibilities and Perils",ANNALS OF THE AMERICAN ACADEMY OF POLITICAL AND SOCIAL SCIENCE,2015,659,1,6,13,7,SSCI - PS,10.1177/0002716215572084,1,0,0,1,1,1,1,0
"Steinert-Threlkeld, Zachary C.",Spontaneous Collective Action: Peripheral Mobilization During the Arab Spring,AMERICAN POLITICAL SCIENCE REVIEW,2017,111,2,379,403,24,SSCI - PS,10.1017/S0003055416000769,0,0,1,1,1,0,0,0
"Stough, Roger; McBride, Dennis",Big Data and US Public Policy,REVIEW OF POLICY RESEARCH,2014,31,4,339,342,3,"SSCI - PS,SSCI - PA",10.1111/ropr.12083,1,1,1,1,0,0,0,0
"Stramp, Nicholas; Wilkerson, John",Legislative Explorer: Data-Driven Discovery of Lawmaking,PS-POLITICAL SCIENCE & POLITICS,2015,48,1,115,119,4,SSCI - PS,10.1017/S1049096514001644,0,1,0,1,0,0,1,0
"Street, Alex; Murray, Thomas A.; Blitzer, John; Patel, Rajan S.",Estimating Voter Registration Deadline Effects with Web Search Data,POLITICAL ANALYSIS,2015,23,2,225,241,16,SSCI - PS,10.1093/pan/mpv002,0,0,1,1,1,0,0,0
"Swanson, Maureen H.; Vogel, Kathleen M.","Big Data, intelligence, and analyst privacy: investigating information dissemination at an NSA-funded research lab",INTELLIGENCE AND NATIONAL SECURITY,2018,33,3,357,375,18,"SSCI - PS,SSCI - IR",10.1080/02684527.2017.1400234,1,1,0,1,1,0,0,0
"Taylor, Isaac","Data collection, counterterrorism and the right to privacy",POLITICS PHILOSOPHY & ECONOMICS,2017,16,3,326,346,20,SSCI - PS,10.1177/1470594X17715249,0,0,1,1,1,0,0,0
